[
  {
    "id": "grant_owner",
    "grantee": "person_alex",
    "role": "owner",
    "scope": "family",
    "layers": ["input", "live", "wiki"],
    "maxSensitivity": "sealed",
    "grantedBy": "person_alex",
    "from": "2026-10-10T09:00:00Z"
  },
  {
    "id": "grant_sam-wiki",
    "grantee": "person_sam",
    "role": "guardian",
    "scope": "family",
    "layers": ["wiki"],
    "maxSensitivity": "family",
    "grantedBy": "person_alex",
    "from": "2026-10-10T09:00:00Z"
  },
  {
    "id": "grant_curate-agent",
    "grantee": "agent_curate",
    "role": "agent",
    "scope": "family",
    "layers": ["input", "live"],
    "maxSensitivity": "private",
    "grantedBy": "person_alex",
    "from": "2026-10-10T09:00:00Z"
  }
]
